Review_ID,Truly_Predicted_Class,Original_Text,Explanation,Label
57,Positive,enough table immediately even without reservation turned everything went right nai perfect atmosphere tastes great great decently cheap dancing dishes wine end meal two great really enjoyed octopus amazing music dancing loud might chatty ,enough immediately without reservation everything 
2412,Negative,want came one take plus charged dollar exact please help math back even looked wondered instead answer pretty damn disappointing rounded sometimes know plain unlucky scam difference business respectful business deserve food round things less never ,want one take plus charged 
272,Positive,place love breakfast place pancakes either apple chocolate chip heard good kinda omelets wide variety one thing usually cream one shakes amazing breakfast time day line goes ,place love apple chocolate good 
1890,Negative,went weekend number mentioned chalkboard discovered meal people probably ordered soft shell crab boy tofu sweet mysteriously contained sweet potatoes probably worst meal hash hand good little greasy little cafã best part although served meal one doubt go ,went number people ordered soft 
894,Positive,place ever since opened enjoy nicas great neighborhood far best hang outside rock weather nice pino great lengths welcoming friendly will often order upon see something rated things wanted inconsistency food messed order guys work cute god guys ,place great neighborhood far best 
3305,Negative,place huge minutes someone finally ask friend mind middle day came take order another good friend impatient nachos mango pork burritos nachos best barely pork sriracha flavorful see back ,huge minutes someone finally ask 
215,Positive,now favorite second tonight service food beyond menu selection good time trying order brunch awesome blt bacon sad bacon even freaking good boyfriend got also important note ordered one one wish ordered beer cedar mary wish bartenders good said day dinner amber waitress top sucking back refills ordered veggie wings brussel sprouts start phenomenal explained us make back including wings wish seitan tried chef refuses serve personally boyfriend option menu went cheese original hey average good place huge sketch anywhere even cedar point cooked perfection sooooo fresh grass brioche bun way compliment place solid cheese burger among need anthony table say hi introduce think took people businesses neighborhood businesses personal introduction told loved back often wish lot luck really great ordered pie dessert average effing good tell menu places grow farm one really shop gets will seating really nice spring go bring friends fishtown ,favorite beyond selection good trying 
2172,Negative,stars atmosphere great food idiot manager seating hour waited two top manager continued us girls wait list tried keep process waiting patron yelled meek waiting begin decides start screwing never seen horrible customer service life say disappointed management stars possible surprised place ,atmosphere food hour two top 
476,Positive,really continental lunch always tasty never center restaurants lobster mac cheese one favorite dishes sizable casserole plenty yummy lobster perfect crunch friendly prices great friends family casual weekend ,really continental always tasty center 
775,Negative,turned experience last many went put told wait hour went street waited well half called ready joke minutes sat making total wait strike incorrect time showed waiter negligent wait assumed wait yes mean point drinks right everything delicious perhaps bit dish anyway now almost midnight dinner ask two wine waiter us closing say meant leave got first time even remotely rude night though pretty annoyed strike dude extra minutes going tell us prior closed bill actually pig afford snacks actually rest menu friendly apologetic friends going back ,turned experience many went put 
34,Positive,friday dinner surprised nai still availability short food service reservation never gave time waitress friendly checked different pitchers pleasee liking wrong bomb croquettes flaky steak patatas bravas bit mealy chunks big opt patatas nothing stood wow fantastic layout seating ambiance warm friendly recommend anyone group ,friday dinner surprised nai reservation 
1002,Negative,used think loudness despite judgemental finally used love place never execution wonderful bothered try marrow interest blue replicate kitchen follies tolerating ribbon experience anyone go blue bone fried tried along marrow better restaurants marrow benchmark marrows till underlying sea slices bread perhaps reason anyone come see hold nose watching going nice dresses nice couple talking elderly right blue nuts dude waiter go waiter water thinks taking orders time trying bone marrow course new york city meal goes hope enjoy stay york dude classier second time told listen last time wanted marrow eat remainder dinner elsewhere want wine fois gras nothing bone oh tolerated times ,used think finally never blue 
